date,path,title,count,uniques
2021-12-04,/astrochun/old_website_nightsky,astrochun/old_website_nightsky: Research-based website using a CSS-based temp...,1,1
2021-12-04,/astrochun/site-hugo-academic/blob/master/.github/workflows/hugo_deploy.yml,site-hugo-academic/hugo_deploy.yml at master 路 astrochun/site-hugo-academic,3,1
2021-12-04,/astrochun/site-hugo-academic,astrochun/site-hugo-academic,1,1
2021-12-04,/astrochun/uarizona-salary-app,astrochun/uarizona-salary-app: Streamlit app to illustrate University of Ariz...,2,2
2021-12-04,/astrochun/uarizona-salary-app/issues/80,"Update streamlit, pandas, etc 路 Issue #80 路 astrochun/uarizona-salary-app 路 G...",1,1
2021-12-04,/astrochun/voxcharta-my-voting-record,GitHub - astrochun/voxcharta-my-voting-record: A Python tool to extract infor...,2,1
