date,path,title,count,uniques
2024-02-16,/astrochun/github-stats-pages,astrochun/github-stats-pages: Retrieve statistics for a user's repositories a...,3,3
2024-02-16,/astrochun/github-stats-pages/issues/68,Docker messaging is incorrect 路 Issue #68 路 astrochun/github-stats-pages,1,1
2024-02-16,/astrochun/MMTtools/blob/master/Documentation_for_mmirs_pipeline_taskfile.pdf,MMTtools/Documentation_for_mmirs_pipeline_taskfile.pdf at master 路 astrochun/...,2,1
2024-02-16,/astrochun/MMTtools,astrochun/MMTtools: A set of Python 2.7 and 3.x codes to use with data from MMT,1,1
2024-02-16,/astrochun/uarizona-salary-app,astrochun/uarizona-salary-app: Streamlit app to illustrate University of Ariz...,1,1
2024-02-16,/astrochun/Zcalbase_gal/blob/master/analysis/deep2_r23_o32/zoom_and_gauss_general.py,Zcalbase_gal/analysis/deep2_r23_o32/zoom_and_gauss_general.py at master 路 ast...,2,1
