date,path,title,count,uniques
2024-06-13,/astrochun/academic-ads-bibtex,astrochun/academic-ads-bibtex: Construct a proper BibTeX file to use with Hug...,2,1
2024-06-13,/astrochun/github-stats,GitHub - astrochun/github-stats: My GitHub stats,1,1
2024-06-13,/astrochun/github-stats-pages,GitHub - astrochun/github-stats-pages: Retrieve statistics for a user's repos...,8,8
2024-06-13,/astrochun/MMTtools,GitHub - astrochun/MMTtools: A set of Python 2.7 and 3.x codes to use with da...,1,1
2024-06-13,/astrochun/test-github-stats/tree/main/data,test-github-stats/data at main 路 astrochun/test-github-stats,5,1
2024-06-13,/astrochun/test-github-stats/tree/main/.github/workflows,test-github-stats/.github/workflows at main 路 astrochun/test-github-stats,3,1
2024-06-13,/astrochun/test-github-stats/blob/main/data/2021-01-17-00h-46m-clone-stats.csv,test-github-stats/data/2021-01-17-00h-46m-clone-stats.csv at main 路 astrochun...,2,1
2024-06-13,/astrochun/test-github-stats/blob/main/.github/workflows/gh-pages-deploy.yml,test-github-stats/.github/workflows/gh-pages-deploy.yml at main 路 astrochun/t...,2,1
2024-06-13,/astrochun/test-github-stats,astrochun/test-github-stats: Testing of GitHub action for GitHub pages deploy...,1,1
2024-06-13,/astrochun/uarizona-salary-app,GitHub - astrochun/uarizona-salary-app: Streamlit app to illustrate Universit...,1,1
